Original Sentence;Word Pattern;Word Count
Elli just prayed that every scream she heard was not her mother’s.;Puvddupuuupu;12
Her mother , pregnant with her third child , had been led away by a doctor or something like that.;pu_u>pun_uvuu>ducvud;20
She didn’t know why they kept her , probably because they thought she was a boy.;puvupup_AupupudG;16
She remembered being brought there , having her hair shaved and everything.;pvvuE_vpuv+v;12
Her best friend was a German outside of the concentration camp , which brought her to the second thing.;puuudPu>duu_pup>duv;19
Elli Berwald was a normal ten year old Jewish girl , except for two things.;PPudu#unnG_uu#v;15
Our brother is painting behind the couch.;nuvvndu;7
Your father will be decorating on the roof.;muvvv>du;8
My mom cleaned under the bed.;yuv>du;6
My children prefer to eat vegetables.;ynu>uu;6
Most librarians enjoy reading;Puuv;4
Word order determines whether a noun phrase is a subject or an object in English.;Puuuduuvducdu>P;15
The puppy hates when I slam the door shut.;duuqyuduu;9
Your mom appreciates that you cleaned the house.;muudmvdu;8
A young couple will have bought the house that we are selling.;dnnvvududpvv;12
I sometimes give my cat fish.;yuvynu;6
A man is cutting a paper;dGvvdu;6
A skateboarder is jumping in the air;duvv>du;7
A man and a woman are walking together through the woods;dG+dGvvu>du;11
The man is playing the guitar;dGvvdu;6
One small child is drinking water from the cup;#nnvvu>du;9
A motorcyclist with a red helmet is riding a blue motorcycle down the road;du>dauvvdanudu;14
A woman is wearing an Egyptian headdress;dGvvdPu;7
A man is spreading dough;dGvvu;5
A dog is walking along a snowdrift;dnvvudu;7
A man is wearing a red jacket and standing beside a yellow canoe on some rocks with water in the background;dGvvdau+vudau>du>u>du;21
A bicyclist is holding a bike over his head in a group of people;duvvdn>pu>dn>n;14
Someone is typing;pvv;3
The girl , who is little , is combing her hair into a pony tail.;dG_qva_vvpu>duu;15
Two pandas are lying together;#uvvu;5
A man is riding a horse;dGvvdn;6
A young boy is playing in the park with his mother;dnGvv>du>pu;11
The boy and girl are playing on the outdoor gym;dG+Gvv>duu;10
Five adults are sitting on stone steps;#nvv>uu;7
A boy is wearing all black and is sliding down a blow up yellow slide;dGvvda+vvudu>au;15
A woman and three men are posing for a photo;dG+#Gvvudu;10
A man in a purple hat is climbing a rocky wall with bare hands;dG>dauvvduu>uu;14
A person is doing a trick on a snowboard;dnvvdu>du;9
A baby is crawling happily;dnvvA;5
Two women are wearing bikinis on the sandy beach;#Gvvu>duu;9
The person is slicing onions;dnvvu;5
A woman is squeezing a lemon;dGvvdu;6
Some women are dancing;dGvv;4
Two people are carrying colorful baskets and blankets and walking near a building;#nvvuu+u+v>dv;13
The football is between the feet of a boy who is lying on the grass;duvudu>dGqvv>du;15
A woman who is wearing a pink boa is riding a bicycle down a bridge built for pedestrians;dGqvvdauvvduuduuuu;18
A young boy is jumping in the air with his knees bent and arms spread;dnGvv>du>puu+uu;15
A man wearing a dyed black shirt is sitting at the table and laughing;dGvdvauvv>du+v;14
A woman is taking off a cloak , which is very large , and revealing an extravagant dress;dGvvudu_pvAu_+vduu;18
A family is watching a little boy who is hitting a baseball;dAvvdaGqvvdu;12
A young boy covered in grass is jumping near a wooden fence;dnGv>uvv>duu;12
Racers are running down a track;uvvudu;6
A person on a yellow dirt bike is taking a jump;dn>dannvvdu;11
The man is riding a horse;dGvvdn;6
Three Asian kids are dancing and a man is looking;#nuvv+dGvv;10
A man is fixing a silencer to a gun;dGvvdu>du;9
A person is climbing a rock with a rope , which is pink;dnvvdu>du_pva;13
The man is playing a guitar;dGvvdu;6
A man is speaking on a stage;dGvv>du;7
A man is walking in the rain;dGvv>du;7
A tiger cub is making a sound;duuvvdu;7
A little black dog is wearing a red collar and is in the leaves with a blue ball;daanvvdau+v>du>dan;18
A dog is playing with a toy;dnvv>du;7
The man is playing with a skull;dGvv>du;7
A girl is exercising;dGvv;4
A man is cutting onions;dGvvu;5
A woman in a purple top is walking a bicycle between two stone columns;dG>dauvvduu#uu;14
Two people in a race are flipping the tires of a tractor;#n>duvvdu>du;12
Two women dressed in white and black are sitting on a bench;#Gv>a+avv>du;12
The panda bear is lying on the logs;duuvv>du;8
A dog is chasing a ball through dirt;dnvvdn>n;8
The man is playing the guitar and has the guitar case open for donations;dGvvdu+uduuuuu;14
A man is playing the guitar;dGvvdu;6
A cyclist on a yellow bike is airborne;du>danvu;8
A brown dog is jumping in the air;danvv>du;8
A boy wearing red shorts is jumping into a paddling pool;dGvanvv>dvu;11
A young girl is dancing;dnGvv;5
A man is breaking a slab of concrete with a sledge hammer;dGvvdu>u>duu;12
A person is wearing a red jacket and holding a beer;dnvvdau+vdu;11
Two brown and white dogs are fighting on a grassy area in front of a tree;#a+anvv>duu>n>dn;16
The girl is trotting on the horse;dGvv>dn;7
Some children are playing on a playground;dnvv>du;7
The black dog is walking through the tall grass;danvv>dnu;9
A man is pushing the buttons of a microwave;dGvvdu>du;9
A woman is slicing an onion;dGvvdu;6
A man is picking up a tree;dGvv>dn;7
A man is rock climbing , pausing and calculating the route;dGvuv_v+vdu;11
A man is riding a water toy in the water;dGvvduu>du;10
A woman is cutting broccoli;dGvvu;5
A woman is beating two eggs in a bowl and using a whisk made of wire;dGvv#u>du+vduu>u;16
A woman is playing the flute;dGvvdu;6
People are walking outside a building that has many murals on it;nvvudvduau>r;12
There is no white dog wearing a Christmas reindeer headband and playing with a brown dog in the grass;Evdanvdunu+v>dan>du;19
Two dogs are playing together on the grass;#nvvu>du;8
There is no man cutting a box;EvdGvdu;7
A man is doing a card trick;dGvvduu;7
The man is pouring oil on a few tomatoes;dGvvu>dau;9
A boy in blue is running away from a woman in blue;dG>avvu>dG>a;12
A man is jumping into an empty pool;dGvv>duu;8
A girl is skipping rope on a sidewalk;dGvnu>du;8
A man in a red jacket and khaki pants is walking through an American state;dG>dau+uuvv>dnn;15
Two people are riding motorbikes;#nvvu;5
A dog is licking a baby;dnvvdn;6
A large white crane is flying near the water;duauvv>du;9
A classroom full of students is looking in the same direction inside a bamboo structure;duu>uvv>dXuuduu;15
A man is walking along a path through a wilderness;dGvvudu>du;10
A woman is chopping up an octopus;dGvv>du;7
A man is playing a flute;dGvvdu;6
A woman is mixing eggs;dGvvu;5
A young girl in a bikini is jumping on the beach;dnG>duvv>du;11
A woman is wearing a colorful shirt and a lot of jewelry;dGvvduu+du>u;12
The man is kick boxing with a trainer;dGvuv>du;8
A biker is wearing gear which is black;duvvupva;8
The girl is recklessly jumping onto a car;dGvAvudn;8
A child is holding a camera in front of his face;dnvvdu>n>pu;11
A man is chopping butter into a container;dGvvn>du;8
The young boy in the blue shirt is jumping into the water;dnG>dauvv>du;12
A girl in a black hat is wearing a bikini at the beach;dG>dauvvdu>du;13
A couple is looking at a map;dnvv>du;7
A boy is filling a pitcher with water;dGvvdu>u;8
One woman is peeling a potato;#Gvvdu;6
A girl is standing in a group and is wearing a black shirt and pink beads;dGvv>dn+vvdau+au;16
The little kid is playing football and falling into the grass;dauvvu+v>du;11
A large group of Asian people is eating at a restaurant;dun>nnvv>du;11
A girl is brushing her hair;dGvvpu;6
A girl in gold and purple is holding a rainbow afghan;dG>u+avvduu;11
A man and a woman are walking down a city street;dG+dGvvudnn;11
A group of rollerbladers is lining up on the street;dn>uvv>>dn;10
A group of people are dancing;dn>nvv;6
A lemur is biting a person's finger;duvvduu;7
Two men are walking through the water;#Gvv>du;7
A young boy is jumping into a still lake;dnGvv>duu;9
A kitten is drinking fresh milk;duvvuu;6
A group of racing dogs is wearing striped uniforms and is running down a track;dn>vnvvvu+vvudu;15
Two dogs are leaping through snowy grass and rocks;#nvv>uu+u;9
The man is singing and playing the guitar;dGvv+vdu;8
Two women are wearing bikinis and are walking on the sand;#Gvvu+vv>du;11
A snowboarder is jumping off the snow;duvvudu;7
A man is wiping the edge of a bowl;dGvvdu>du;9
A girl in an orange shirt and clown makeup is standing in a park and others are looking on;dG>dau+uuvv>du+uvv>;19
A football player in a purple jersey is running with the ball for a touchdown;duu>dauvv>dnudu;15
A guy is riding a horse;dnvvdn;6
Someone is cooking okra in a pan;pvvu>du;7
Three people are driving four wheel ATVs in a field;#nvv#uP>du;10
Three men are jumping off a wall;#Gvvudu;7
A little boy is running on the ground and playing with a little girl;daGvv>du+v>daG;14
A toy train is striking a toy car;duuvvdun;8
A black dog is running in the grass;danvv>du;8
A man is cutting a box;dGvvdu;6
Two daschunds are playing with a red ball;#uvv>dan;8
A man is wearing a purple shirt and black leather chaps and is posing for the camera;dGvvdau+auu+vvudu;17
Three men are looking into the distance;#Gvv>du;7
A man is singing into a microphone;dGvv>du;7
A man in a big city is holding a sign and begging for money;dG>dunvvdu+vuu;14
Three men are practicing karate in a field;#Gvvu>du;8
A girl in a white dress is running;dG>dauvv;8
A person is playing a piano;dnvvdu;6
A large dog is running on the grass with a tennis ball in its mouth;dunvv>du>dun>ru;15
A dog is running towards a ball;dnvvudn;7
A woman is pouring eggs into a frying pan;dGvvu>dvu;9
A boat is sailing peacefully over the water;duvvA>du;8
A dog , which is large and gray , is carrying a ball in its mouth and running across the grass;dn_pvu+a_vvdn>ru+v>du;21
A person is chopping an onion;dnvvdu;6
The man is walking along a path through the wilderness;dGvvudu>du;10
The woman is picking up a baby kangaroo;dGvv>dnu;8
A man is jumping onto a low wall;dGvvuduu;8
The woman is dicing garlic;dGvvn;5
A deer is jumping over a cyclone fence;duvv>duu;8
A woman is putting a baby in a waste bin;dGvvdn>duu;10
A guy is cheerfully playing with a footbag;dnvAv>du;8
A cheetah is quickly running behind its prey.;duvAvnru;8
A woman in a fur hat and fur coat is standing outside a building;dG>duu+uuvvudv;14
A brown and white dog is catching a dirty tennis ball in a dirt field;da+anvvduun>dnu;15
A woman is cracking an egg into a bowl;dGvvdu>du;9
The little dog is grabbing the bedroom slipper with its mouth;danvvduu>ru;11
The dog is knocking a boy into the water;dnvvdG>du;9
A man is strolling in the rain;dGvv>du;7
A band is playing some instruments;duvvdu;6
The men in brown shorts are walking on the rocks beside a river;dG>anvv>duudu;13
A brown and white dog is jumping in the air with a tennis ball in its mouth;da+anvv>du>dun>ru;17
A person who is practicing snowboarding jumps into the air;dnqvvvu>du;10
A boy is running through the sand;dGvv>du;7
A black dog and a yellow dog are playing with each other;dan+danvv>du;12
A man is playing an acoustic guitar;dGvvduu;7
Two toddlers are eating corndogs in a wagon , which is really small;#nvvu>du_pvAn;13
A woman is slicing garlic;dGvvn;5
A cat is stuck on a moving ceiling fan;dnvu>dvvu;9
The black dog is walking along a tree trunk bridge over water;danvvudnuu>u;12
A woman in a white dress and a woman in a blue dress are standing on a stage;dG>dau+dG>dauvv>du;18
A person is brushing a cat;dnvvdn;6
The person is setting fire to the cameras;dnvvu>du;8
A man is performing a trick on a surfboard in the water;dGvvdu>du>du;12
A large dog and a small dog are standing next to the kitchen counter and are investigating;dun+dnnvvu>duu+vv;17
A tiger is walking around;duvvu;5
A family is posing by the mantel and the Christmas tree;dAvv>du+dun;11
The lady is holding the paintbrush next to the artist's easel ;duvvduu>duu;11
A little boy is jumping into a puddle on the street;daGvv>du>dn;11
A light brown dog is running up a street;duanvv>dn;9
Some ingredients are being mixed in a bowl by a person;duvvv>du>dn;11
Five people are standing with three dogs in the green field beside the road;#nvv>#n>dauudu;14
A couple of boys are playing a video game;dn>Gvvduu;9
A lady is cutting up some meat;duvv>du;7
The man is putting chicken into the container;dGvvu>du;8
A panda is climbing;duvv;4
The children are wearing black tights and hopping;dnvvau+v;8
A girl is playing a guitar;dGvvdu;6
A man is rinsing a large steak;dGvvduu;7
A man is putting garlic on some bread slices;dGvvn>duu;9
The rhino is grazing on the grass;duvv>du;7
The person is drawing;dnvv;4
The man is adding seasoning to the water in a bowl;dGvvv>du>du;11
Two men are playing table tennis;#Gvvuu;6
A white race car is driving through a puddle;daunvv>du;9
A woman is cutting meat;dGvvu;5
A baby is playing with a doll;dnvv>du;7
Two boys are wearing brown shirts and are tugging at a rope on a wooden platform;#Gvvau+vv>du>duu;16
A woman is looking down and is wearing a wedding veil;dGvvu+vvdvu;11
The black bird is sitting in a leafless tree;dauvv>dun;9
A chef is cleaning a bowl of soup;duvvdu>u;8
A girl in a strange outfit is riding the bike;dG>duuvvdn;10
A bike rider in a black and red uniform is standing on a dirt bike;dnu>da+auvv>dnn;15
Four people are sitting on a low cement ledge;#nvv>duuu;9
A man is slicing a fish;dGvvdu;6
Two children are hanging on a large branch;#nvv>duu;8
Two kids are pushing an inflatable crocodile in a pool;#uvvduu>du;10
A brown and black dog is running through the leaves;da+anvv>du;10
A cat is playing a piano;dnvvdu;6
Two women are talking;#Gvv;4
A group of people is walking;dn>nvv;6
A kid is drawing;duvv;4
A cook is breaking eggs;duvvu;5
A person is riding an old horse;dnvvdnn;7
An onion is being cut by a woman;duvvu>dG;8
A man is quickly running uphill;dGvAvu;6
Many kids are skating in an ice park;auvv>dnu;8
There is no girl dancing;EvdGv;5
The boy is doing floor exercises;dGvvuu;6
A little dog is drinking fresh water;danvvuu;7
A man is jumping into the sea;dGvv>du;7
A woman is playing an electric guitar;dGvvduu;7
An aircraft is landing;duvv;4
Some milk is being drunk by a man;duvvu>dG;8
An orange is being sliced by a man;davvv>dG;8
A man is playing an instrument;dGvvdu;6
A woman is eating;dGvv;4
An elephant is wading through a river;duvv>du;7
A man is slicing potatoes;dGvvu;5
A girl is diving into the water;dGvv>du;7
A cat is playing with a toy;dnvv>du;7
An animal is grazing in a field;duvv>du;7
An onion is being cut by a man;duvvu>dG;8
A man is riding a skateboard;dGvvdu;6
A girl is riding a brown horse;dGvvdan;7
A woman , who is seated , is singing a song and playing the guitar;dG_qvv_vvdu+vdu;15
Men are cutting wood;Gvvu;4
A man and a woman are walking together through the city;dG+dGvvu>dn;11
A person on a bike is riding on one wheel only;dn>dnvv>#uA;11
The kitten isn't eagerly drinking some milk from the bowl;duCAvdu>du;10
A skateboarder is jumping off a ramp;duvvudu;7
A sea turtle is not hunting for fish;duuvuvuu;8
A boy in blue are sliding down a green slide;dG>avvudau;10
The woman with a black hat is wearing sunglasses;dG>dauvvu;9
A woman is slicing meat with a knife;dGvvu>du;8
A dog is walking along the snowdrift;dnvvudu;7
A man is wearing a red jacket and standing beside a yellow canoe on some boulders with water in the background;dGvvdau+vudau>du>u>du;21
The adults and children are being grouped near an outdoor seating arrangement;dn+nvvv>duvu;12
A lone bicyclist is putting down a bike;duuvvudn;8
One man is eating some food;#Gvvdu;6
A horse is being ridden by a man;dnvvu>dG;8
Five kids are standing close together and one kid has a weapon;#uvvuu+#uudu;12
A boy in blue is running towards a woman in blue;dG>avvudG>a;11
Some children are not playing on a playground;dnvuv>du;8
Five adults are sitting on a chair;#nvv>du;7
A girl is speeding down a steep slide;dGvvuduu;8
There is no man on a bicycle riding on the beach;EvdG>duv>du;11
A woman and three men are denying a photo;dG+#Gvvdu;9
There are no men sitting at the table with four beer bottles;EvdGv>du>#uu;12
The young man is not rock climbing;dnGvuuv;7
A person is not doing a trick on a slide;dnvuvdu>du;10
A woman is cooking a pork chop which is breaded;dGvvduupvv;10
A boy , who is wearing a blue coat , is being held by his father under an umbrella ;dG_qvvdau_vvu>pu>du;19
There are no women wearing bikinis on the sandy beach;EvdGvu>duu;10
The person is riding the animal;dnvvdu;6
A man is not playing a guitar;dGvuvdu;7
Some women are cheerfully dancing;dGvAv;5
The people are not walking on the road beside a beautiful waterfall;dnvuv>duuduu;12
The woman wearing silver pants , pink bellbottoms and a pink scarf is riding a bike;dGvuu_au+dauvvdn;16
A person with a green shirt is jumping onto the grass;dn>dauvvudu;11
A young boy covered in grass is jumping near a fence made of wood;dnGv>uvv>duu>u;14
The blonde girl with the pink top is happily smiling and wearing funny glasses with a large nose attached;duG>dauvAv+vuu>duuv;19
Some men are resting;dGvv;4
A kid is putting the guitar away;duvvduu;7
The group of people is sitting in a room which is dim;dn>nvv>dupvu;12
There are no children playing and waiting;Evdnv+v;7
There is no man fitting a silencer to a pistol;EvdGvdu>du;10
Someone is putting ingredients into a wok;pvvu>du;7
The white reindeer wearing dog ears is near a brown reindeer;danvnuv>dan;11
A young black child is waiting on the edge of a body of water near some buckets;dnanvv>du>du>u>du;17
The man is walking along a track through the wilderness;dGvvudu>du;10
A man is tanking on a stage in front of a crowd;dGvv>du>n>dn;12
No person is hiking;dnvv;4
A baby is splashing inside a blue paddling pool;dnvvudavu;9
A young occidental girl is standing above the crowd and is playing with a pinwheel;dnuGvvudn+vv>du;15
The man isn't smearing butter on bread ;dGCvn>u;7
The teens are talking to a boy and a girl with a webcam;duvv>dG+dG>du;13
Two poodles are in the snow and one is jumping high;#uv>du+#vvu;11
An animal is jumping at a shiny blue soccer ball in a field of dry leaves;duvv>duaun>du>uu;16
There is no dog eating a doll;Evdnvdu;7
The person is playing with a skull;dnvv>du;7
A group of explorers are walking through the grass;dn>uvv>du;9
A girl dressed in purple and blue is slowly walking beside her bike at night;dGv>a+avAvupn>u;15
The boy is not cutting the grass by the curb with scissors;dGvuvdu>du>u;12
Two people are sitting on a park bench on a hot day;#nvv>duu>duu;12
The panda bear is resting on the logs;duuvv>du;8
There is no man squirting water into the mouth of a white dog with a squirt gun;EvdGvu>du>dan>duu;17
The man is putting away the guitar in the guitar case;dGvvudu>duu;11
The guitar is being played by a man;duvvv>dG;8
A person on a yellow clean bike is taking a jump;dn>daunvvdu;11
A nearby throng of people are kissing two by two;duu>nvv#>#;10
A young boy wearing a red swimsuit is jumping into a blue kiddies pool;dnGvdauvv>danu;14
The woman is not poking holes in the potato;dGvuvu>du;9
A man is moving gracefully;dGvvA;5
A dog is jumping at dry leaves in a field of shiny blue soccer balls;dnvv>uu>du>uaun;15
A woman , who is old , is near a dog that has a white coat;dG_qvn_v>dndudau;16
The woman is using a sledgehammer to break a concrete block that is on another man;dGvvdu>uduudv>uG;16
Three people are walking across a rope and steel bridge over a river;#nvv>du+uu>du;13
Two black puppies are playing near a pool;#anvv>du;8
A man is being pushed toward the buttons of a microwave;dGvvvudu>du;11
A girl dressed in purple and blue is walking beside her bike at night;dGv>a+avvupn>u;14
One small child is greedily drinking water from the cup;#nnvAvu>du;10
There is no woman putting on lipstick;EvdGv>u;7
There is no woman slicing an onion;EvdGvdu;7
Two dogs are looking at something that is moving in the water;#nvv>vdvv>du;12
A man is not rock climbing and a city and a bay are in the background;dGvuuv+dn+duv>du;16
A tan dog which is dirty is rolling in the dirt and looking right at the camera;danpvuvv>dn+vu>du;17
Two sumo wrestlers are fighting;#uuvv;5
The drums are being played by a man;duvvv>dG;8
Two children are playing soccer in the park;#nvvu>du;8
A big dog and a small dog with a white coat are playing together;dun+dnn>dauvvu;14
A pianist is playing the keyboard;duvvdu;6
The man is riding a horse by a stream;dGvvdn>du;9
A homeless man is holding up a sign and is begging for money;duGvv>du+vvuu;13
A man is having fun with water;dGvvu>u;7
Few men like pouring tomato oil;aGuvuu;6
A boy of young age is playing in the park with his mother;dG>nuvv>du>pu;13
A girl is jumping rope on a sidewalk near a parking garage;dGvvu>du>dvu;12
A dog , which is small , is playing on the green grass;dn_pvn_vv>dau;13
People are sitting around a bonfire at night;nvvudu>u;8
The dog is licking the baby;dnvvdn;6
A tomato is being sliced by a woman;duvvv>dG;8
A person with a red hooded jacket and a black backpack is moving near a rocky wall;dn>davu+dauvv>duu;17
A man is walking along a track through a wilderness;dGvvudu>du;10
A girl is wearing a t-shirt and has her mouth open.;dGvvdn+upuu;11
Rugby players are tackling each other;nuvvdu;6
A white bird is landing swiftly in the water;dauvvA>du;9
The man is not playing the guitar;dGvuvdu;7
There is no woman mixing eggs;EvdGvu;6
A man with Indian clothing and henna on his hand is going through paperwork;dG>Pv+u>puvv>u;14
There is no young lady with light brown hair wearing a red necklace , a sweatshirt and earrings and smiling;Evdnu>uauvdau_du+u+v;20
The woman is wearing a colorful shirt and a lot of jewelry;dGvvduu+du>u;12
A karate practitioner is kicking at another man who is wearing protective gloves for boxing;duuvv>uGqvvuuuv;15
A biker is naked;duvv;4
There is no child holding a camera in front of his face;Evdnvdu>n>pu;12
Butter is being chopped into a container by a man;nvvv>du>dG;10
A young boy in the blue shirt is jumping into the water;dnG>dauvv>du;12
An animal is being ridden by a woman;duvvu>dG;8
A child with dark hair is going down a slide and throwing up his arms;dn>uuvvudu+v>pu;15
The people are walking on the road beside a waterfall , which is beautiful;dnvv>duudu_pvu;14
A dog is looking at a piece of furniture in a shop;dnvv>du>u>du;12
A couple is looking at a street guide;dnvv>dnu;8
A pitcher is being filled with water by a boy;duvvv>u>dG;10
A walker is in a hat store for men;duv>duuuG;9
A girl has black and orange patches on the cheeks;dGua+au>du;10
The chef is carefully drying the oil from the pan;duvAvdu>du;10
Five people are running with three dogs in the green field beside the road;#nvv>#n>dauudu;14
There is no man playing a keyboard;EvdGvdu;7
Two little boys are not wearing tuxedos;#aGvuvu;7
A blonde man is hanging by gymnastic ropes;duGvv>uu;8
Two white dogs are not running together;#anvuvu;7
A man and a woman are not shaking hands;dG+dGvuvu;9
There is no white dog with beige spots running through a field;Evdan>uuv>du;12
Rollerbladers are rolling in formation down a hill;uvv>uudu;8
The person is peeling an onion;dnvvdu;6
An Asian woman in a crowd is not carrying a black bag;dnG>dnvuvdau;12
A person is severing the toe of an empty leather boot with a sword;dnvvdu>duuu>du;14
A boy is jumping off a platform and two other boys are standing and staring at him;dGvvudu+#uGvv+v>p;17
Two men are walking through a river;#Gvv>du;7
There is no milk being drunk by a cat;Evduvu>dn;9
The man is gracefully singing and playing the guitar;dGvAv+vdu;9
Two women are naked and are standing on the sand;#Gvv+vv>du;10
A man is making a sketch;dGvvdu;6
A dog that has a white and brown colored coat is trotting through shallow water.;dnduda+avuvv>uu;15
Three boys are carefully walking on rocks along a river;#GvAv>uudu;10
A classroom is empty;duvu;4
A man is cleaning the edge of a bowl;dGvvdu>du;9
A man who is playing dunks the basketball into the net and a crowd is in background;dGqvvudu>du+dnv>u;17
There is no woman slicing a carrot;EvdGvdu;7
There is no football player in a purple jersey running with the ball for a touchdown;Evduu>dauv>dnudu;16
A man is riding a horse in the desert;dGvvdn>du;9
Someone is being boiled with okra in a pot;pvvv>u>du;9
Three people are driving four wheel ATVs in a street;#nvv#uP>dn;10
A young , topless woman is covered in paint;dn_uGvv>u;9
The young child is splashing in the water;dnnvv>du;8
A boy is effortlessly climbing up a wall artificially built for climbing and is attached to a rope;dGvAv>duAuuv+vv>du;18
The equipment in front of the blond dancing girl is sound;du>n>davGvu;11
One person is slicing a clove of garlic into pieces;#nvvdu>n>u;10
A toy train is missing a toy car;duuvvdun;8
A woman is not riding a horse;dGvuvdn;7
Two cats are playing with a red ball;#nvv>dan;8
A person is wrapping up an onion;dnvv>du;7
A child is watching someone playing outdoors and is spouting water over the rest of his family ;dnvvpvu+vvu>du>pA;17
A model is wearing a purple shirt and black leather chaps and is posing for the camera;duvvdau+auu+vvudu;17
Three men are looking at something nearby;#Gvv>vu;7
Two people wearing helmets are driving over the yellow and white flowers;#nvuvv>da+au;12
The woman in a red costume is not leaning against a brick wall and is not playing an instrument;dG>dauvuvuduu+vuvdu;19
There is no monkey brushing the dog;Evduvdn;7
A woman is riding a scooter for water;dGvvduuu;8
Three boys in karate costumes aren't fighting;#G>uuCv;7
There is no woman putting meat in a pan;EvdGvu>du;9
There is no kitten drinking milk;Evduvu;6
Three men are practicing karate outdoors;#Gvvuu;6
A man is cleaning the sink;dGvvdu;6
The boy and girl are not playing on a playground;dG+Gvuv>du;10
The man is not walking along a path through the wilderness;dGvuvudu>du;11
The woman is putting down the kangaroo;dGvvudu;7
